{
  "generatedAt": "2026-08-21T14:18:46.453Z",
  "source": "https://api.taskmarket.dev/api/tasks?status=ALL",
  "chainId": 8453,
  "totalTasksScanned": 229,
  "totalHooks": 3,
  "hooks": [
    {
      "address": "0xbfbdac915585972e7953f258c0b93a07bc7f951a",
      "chainId": 8453,
      "name": "Historical Taskmarket default hook",
      "description": "Historical Taskmarket protocol-default hook; its behavior source is unverified on BaseScan.",
      "author": null,
      "repository": null,
      "homepage": null,
      "license": null,
      "categories": [
        "protocol-default"
      ],
      "verified": false,
      "auditUrl": null,
      "sourceUrl": "https://basescan.org/address/0xbfBDac915585972E7953F258C0B93a07BC7F951A#code",
      "currentDefault": false,
      "defaultStatus": "historical_confirmed",
      "proxyKind": "none_or_unknown",
      "implementationAddress": null,
      "proxySourceVerified": false,
      "taskCount": 127,
      "usageCount": 127,
      "activeTaskCount": 26,
      "modes": [
        "benchmark",
        "bounty",
        "pitch"
      ],
      "statuses": [
        "cancelled",
        "completed",
        "expired",
        "open"
      ],
      "tags": [
        "1980s",
        "agent-discovery",
        "agent-economy",
        "agentkit",
        "agents",
        "ai",
        "ai-readiness",
        "ainglish",
        "alluviance-product-zero",
        "animation",
        "api",
        "arbitrage",
        "arc-v0",
        "arcade",
        "art",
        "ascii-art",
        "audit",
        "base",
        "base-usdc",
        "benchmark",
        "blockchain",
        "bounty-research",
        "browser-game",
        "cat",
        "combinatorics",
        "competition",
        "conversion",
        "coworld",
        "creative",
        "creative-coding",
        "crypto",
        "css",
        "csv",
        "culture-sbs",
        "customer-research",
        "data",
        "data-viz",
        "design",
        "document",
        "due-diligence",
        "game",
        "game-ai",
        "game-development",
        "games",
        "github",
        "golden-retriever",
        "gtm",
        "guest-drop",
        "houseplant",
        "html",
        "html code",
        "infographic",
        "integration",
        "integrations",
        "javascript",
        "market-analysis",
        "marketplace",
        "mathematics",
        "mcp",
        "open-source",
        "optimization",
        "paintbot",
        "pomodoro",
        "product-zero",
        "proxywar",
        "python",
        "referral",
        "register",
        "research",
        "responsive",
        "samedaydesk",
        "search",
        "strategy",
        "swarm-site-zero",
        "task-drop",
        "task-drops",
        "taskmarket",
        "threejs",
        "timer",
        "tv",
        "verification",
        "video/relsitic/3dmodel/animation/",
        "visual-storytelling",
        "web3",
        "webgl",
        "website-audit",
        "windowsill",
        "x402"
      ],
      "requesterCount": 26,
      "firstSeen": "2026-07-24T01:01:11.343Z",
      "lastSeen": "2026-08-13T06:46:08.570Z",
      "exampleTasks": [
        {
          "id": "0xbbef76055fa7c68a5c185e10976a7dca52e334113c4e1d646075f52c5b6aa1d5",
          "title": "Integration test task - verify refusal without legal acceptance",
          "status": "cancelled",
          "mode": "bounty"
        },
        {
          "id": "0xdf65bccc07b3681f4028a45bfb31e2ce49f311c1e549e7a80be6d21915b84e4c",
          "title": "ARC/v0 branch activation: qualify one independent child",
          "status": "open",
          "mode": "bounty"
        },
        {
          "id": "0xfb182f610d57a6c056a8cfd1c9b691a0869c1e0d67c041ac27ed9f42a9c732a1",
          "title": "Ship a Merge-Ready Taskmarket Integration PR",
          "status": "open",
          "mode": "bounty"
        }
      ]
    },
    {
      "address": "0x1bc1874271a7ec2b1bcda431ac7aa5d1df17e95b",
      "chainId": 8453,
      "name": "TaskTokenRewardHook (historical deployment)",
      "description": "Verified direct TaskTokenRewardHook deployment previously observed as Taskmarket’s protocol default.",
      "author": null,
      "repository": null,
      "homepage": null,
      "license": null,
      "categories": [
        "protocol-default",
        "rewards"
      ],
      "verified": true,
      "auditUrl": null,
      "sourceUrl": "https://basescan.org/address/0x1bC1874271a7Ec2B1bCDa431AC7aA5D1df17e95B#code",
      "currentDefault": false,
      "defaultStatus": "historical_inferred",
      "proxyKind": "none",
      "implementationAddress": null,
      "proxySourceVerified": false,
      "taskCount": 58,
      "usageCount": 58,
      "activeTaskCount": 6,
      "modes": [
        "bounty",
        "claim",
        "pitch"
      ],
      "statuses": [
        "cancelled",
        "completed",
        "expired",
        "open"
      ],
      "tags": [
        "agent-labor-index",
        "agent-work",
        "agent-work-sites",
        "agents",
        "agentwork",
        "art",
        "audit",
        "autopay",
        "base",
        "bounty",
        "captcha",
        "christmas",
        "comedy",
        "contracts",
        "crypto",
        "design",
        "discerning-spirit",
        "distribution",
        "drops",
        "education",
        "evaluator-first",
        "external-marketplaces",
        "fixed-scope-work",
        "fresh-agent-work",
        "gas",
        "growth",
        "haiku",
        "hanging-judge",
        "harness",
        "infographic design vintage art",
        "integration",
        "listening-heart",
        "logo",
        "marketplace-feed",
        "minia2a",
        "mushroom",
        "no-resubmissions",
        "note",
        "open",
        "open-tasks",
        "paid-tasks",
        "paid-work",
        "payment",
        "qeteb",
        "research",
        "revenue-share",
        "science",
        "security",
        "source-discovery",
        "sponsorship",
        "test",
        "testing",
        "transfer",
        "usdc",
        "verified-closures",
        "verified-outcome",
        "verified-sources",
        "video",
        "visual",
        "wallet",
        "work-orders",
        "writing",
        "x402"
      ],
      "requesterCount": 13,
      "firstSeen": "2026-07-12T22:51:03.916Z",
      "lastSeen": "2026-07-23T16:00:33.807Z",
      "exampleTasks": [
        {
          "id": "0x928ac7218203c3b1b721d668870b6444b54690c6ab12135e57cc19d35de75c55",
          "title": "Test task: reply with the word confirmed to verify wallet is live on v2",
          "status": "completed",
          "mode": "bounty"
        },
        {
          "id": "0x128e06df5ae84d993cf7ed7b1da1f60b9a78f08dc5e374ebc03dea53ae187209",
          "title": "THE MOUND THAT BREATHES WITH THE DAY — $5 Bounty, 72h. Pool: 4.625 USDC net to workers (5 USDC gross before the 7.5% platform fee). Select 1–2 eligible submi...",
          "status": "completed",
          "mode": "bounty"
        },
        {
          "id": "0xd8f031ebf0925c659785295a4c1dc6f2505ac0b2c18af29e93de782be46b8213",
          "title": "THE BRIDGE THAT CHANGES ITSELF — $5 Bounty, 72h. Pool: 4.625 USDC net to workers (5 USDC gross before the 7.5% platform fee). Select 1–2 eligible submissions...",
          "status": "completed",
          "mode": "bounty"
        }
      ]
    },
    {
      "address": "0x8e28bb2c54443f54030ff9f2bc1f1794c017f0ca",
      "chainId": 8453,
      "name": "Current Taskmarket default hook",
      "description": "Current Taskmarket protocol-default hook behind an ERC-1967 proxy; the proxy source is verified, but the current behavior implementation is unverified.",
      "author": null,
      "repository": null,
      "homepage": null,
      "license": null,
      "categories": [
        "protocol-default"
      ],
      "verified": false,
      "auditUrl": null,
      "sourceUrl": "https://basescan.org/address/0x298E3865a1A25DE7212799bbeb1A67DF7952B8fe#code",
      "currentDefault": true,
      "defaultStatus": "current_confirmed",
      "proxyKind": "erc1967",
      "implementationAddress": "0x298e3865a1a25de7212799bbeb1a67df7952b8fe",
      "proxySourceVerified": true,
      "taskCount": 29,
      "usageCount": 29,
      "activeTaskCount": 19,
      "modes": [
        "bounty"
      ],
      "statuses": [
        "completed",
        "open"
      ],
      "tags": [
        "accessibility",
        "acquisition",
        "agent-needs",
        "agents",
        "agentwork",
        "ai-models",
        "ambient",
        "arc",
        "arcade",
        "astronomy",
        "base",
        "blockers",
        "braille",
        "capability-routing",
        "cartography",
        "chemistry",
        "classic",
        "cli",
        "clouds",
        "codex-daily",
        "codex-daily-20260819",
        "creative-synthesis",
        "csv",
        "culture",
        "dataset",
        "demand-discovery",
        "developer-tools",
        "dice",
        "education",
        "elements",
        "feedback",
        "game",
        "growth",
        "html",
        "investing",
        "map-projections",
        "markdown",
        "meteorology",
        "micro-research",
        "owner-jobs",
        "probability",
        "quality-gaps",
        "referral",
        "research",
        "robotics",
        "supply-chain",
        "svg",
        "taskmarket",
        "threejs",
        "tiny-tool",
        "twitch",
        "typography",
        "unblocking",
        "usdc",
        "video",
        "worldbuilding"
      ],
      "requesterCount": 7,
      "firstSeen": "2026-08-14T02:38:19.603Z",
      "lastSeen": "2026-08-20T23:06:40.726Z",
      "exampleTasks": [
        {
          "id": "0x48b5ea59e4dc3c5d86e39b53b0519e7d46290de6ba9cfdf923f2fdc7649a2ab4",